question,answer1,answer2,answer3,answer4,correct_answers,dummy
"What is China's main approach to mitigating the quantum threat to cryptography?", "Relying solely on international PQC standards developed by NIST.", "Developing and standardizing its own PQC algorithms in parallel with international efforts.", "Ignoring the threat, considering it a distant concern.", "Banning the use of all public-key cryptography.",2,dummy
"Which organization in China is primarily responsible for driving PQC research and standardization?", "The Chinese Academy of Sciences (CAS).", "The Ministry of Industry and Information Technology (MIIT).", "The Chinese Association for Cryptologic Research (CACR).", "The Cyberspace Administration of China (CAC).",3,dummy
"What is the status of China's efforts in developing post-quantum cryptographic standards?", "China has not yet initiated any efforts in PQC standardization.", "China is actively developing its own PQC standards, with some already finalized.", "China is solely relying on international standards.", "China is collaborating with NIST on joint PQC standards.", 2,dummy
"Besides post-quantum cryptography (PQC), what other technology is China actively pursuing to address quantum-related security risks?", "Quantum computing.", "Quantum key distribution (QKD).", "Artificial intelligence (AI).", "Blockchain technology.",2,dummy
"What was the motivation behind the PQC competition held by the Chinese Association for Cryptologic Research (CACR)?", "To select algorithms for immediate standardization.", "To encourage research and development of PQC algorithms in China.", "To compete directly with NIST's PQC standardization process.", "To demonstrate China's technological superiority in cryptography.",2,dummy
