question,answer1,answer2,answer3,answer4,correct_answers,dummy
"What is ML-DSA?","A code-based key encapsulation mechanism.", "A lattice-based digital signature algorithm.", "A hash-based signature scheme.", "A classical digital signature algorithm vulnerable to quantum attacks.", 2,dummy
"What is the hardness assumption underlying the security of ML-DSA?", "The difficulty of solving the discrete logarithm problem.", "The difficulty of factoring large integers.", "The hardness of the module learning with errors (MLWE) and module small integer problem (MSIS) problems.", "The security of cryptographic hash functions.", 3,dummy
"Which organization standardized ML-DSA?", "The National Institute of Standards and Technology (NIST).", "The European Telecommunications Standards Institute (ETSI).", "The Internet Engineering Task Force (IETF).", "The International Organization for Standardization (ISO).", 1,dummy
"What are the advantages of ML-DSA?", "It is based on well-established and thoroughly studied mathematical problems.", "It offers relatively small key and signature sizes compared to some other post-quantum signature schemes.", "It has undergone extensive security analysis and scrutiny by the cryptographic community.", "All of the above.", 4,dummy
"What document specifies the ML-DSA algorithm and its parameters?", "FIPS 186-5, Digital Signature Standard (DSS).", "FIPS 204, Module-Lattice-Based Digital Signature Standard.", "SP 800-57, Part 1, Recommendation for Key Management.", "RFC 9380, Hashing to Elliptic Curves.", 2,dummy
